{
  "schemaVersion": 1,
  "id": "33333333-3333-4333-8333-333333333333",
  "revision": 1,
  "status": "closed",
  "goal": "Preserve a historical closed session",
  "createdAt": "2026-08-01T00:00:00.000Z",
  "updatedAt": "2026-08-01T00:00:01.000Z",
  "start": {},
  "observations": [],
  "close": {
    "closedAt": "2026-08-01T00:00:01.000Z",
    "outcome": "investigated",
    "summary": "Historical session summary.",
    "scope": {},
    "current": {},
    "findings": [],
    "openFindings": [],
    "recommendations": [],
    "guardrails": [],
    "knowledgeCandidates": [],
    "handoff": {
      "schemaVersion": 1,
      "sessionId": "33333333-3333-4333-8333-333333333333",
      "generatedAt": "2026-08-01T00:00:01.000Z",
      "objective": "Preserve a historical closed session",
      "outcome": "investigated",
      "repository": {"available": false, "reason": "fixture"},
      "sessionScope": [],
      "accomplished": [],
      "decisions": [],
      "openQuestions": [],
      "completedChanges": [],
      "activeChanges": [],
      "openFindings": [],
      "nextActions": [],
      "nextAction": {"priority":"P3","action":"Review the next user-prioritized goal.","reason":"No additional historical evidence was recorded.","evidenceType":"observed","evidence":[],"confidence":"high"},
      "guardrails": [],
      "knowledgeCandidates": [],
      "agentInstruction": "Continue from preserved session evidence and re-check current project state."
    },
    "policy": "Historical session evidence remains advisory and does not promote durable truth."
  }
}
